,is_free_shipping,product_name,start_price,end_price,is_prompt,start_time,end_time,timedelta,bidders,setsumei,good,bad,capture_count
0,1,送料無料/おまけあり/第2世代/第二世代/2019/新型/新品未使用/正規品/左耳のみ/左のみ/左側のみ/Apple AirPods/エアーポッズ/アップル/ト,6700,6700,1,2019-10-12 09:15:58,2019-10-12 23:28:37,14.0,1,送料無料■左耳のみ■第2世代、新型のAirPods（2019年版）■新品未使用■Apple正規品 ■おまけとして、写真にうつっているイヤピース（両耳）をお付けします。,663,37,0
1,1,新品 未使用 AirPods with Charging Case 新型(エアーポッズ/第2世代) MV7N2J/A 【純正】,17000,18500,1,2019-10-09 14:39:07,2019-10-12 14:39:07,72.0,1,新品 未使用 AirPods with Charging Case 新型(エアーポッズ/第2世代) MV7N2J/A 【純正】商品説明～Apple AirPods with Charging Case (最新モデル)～★新品未開封で、保存状態は良好です。★商品詳細・商品※内容物はすべてそろっていますAirPods（左右）Charging Case・接続AirPods：BluetoothCharging Case：Lightningコネクタ・充電AirPods（1回の充電）：最大5時間の再生、最大3時間の連続通話Charging Caseで15分充電：最大3時間の再生、または最大2時間の連続通話～補足～★当方、ペットは飼っておりません★タバコは吸っておりません注意事項☆こちらからの連絡を待たず、必要事項のご連絡をお願いします。☆商品を緩衝材等で保護し、レターパックプラスで無料発送します。☆商品の到着日を含めて必ず5日以内に商品をご確認ください。万が一商品説明と異なる重大な欠陥や破損があった場合は、商品の到着を含めて5日以内にご連絡をいただければ返品・返金をうけたまわります。☆評価の悪い方は入札の取り消し、もしくは落札キャンセルをさせて頂く場合が御座いますのでご了承下さい。発送詳細■Yahoo!かんたん決済 こちらの商品案内は 「■@即売くん4.85■」 で作成されました。この他にも出品しておりますので宜しければご覧ください。,200,0,3
2,0,Apple純正 AirPods 第2世代 イヤホン MV7N2J/A 充電ケース＋lighteningケーブルのみ イヤホン無し 新品未使用品,7300,7300,1,2019-10-11 04:07:15,2019-10-12 14:22:19,34.0,1,Apple純正 AirPods 第2世代 イヤホン MV7N2J/A 充電ケース＋lighteningケーブルのみ イヤホン無し 新品未使用品セット内容純正充電ケース純正lighteningケーブル箱クイックスタートガイド※充電ケースとlighteningケーブルのみになります。ワイヤレス充電には対応していません。イヤホンはありません。ご注意下さい。配送は以下にて行います。レターパックプラス 全国一律送料520円（追跡番号有り 保証無し）お支払いはヤフオク簡単決済のみになります。,2744,10,0
3,0,最終★税込【新品/未開封品/未使用品】AirPods 第2世代 with charging Cace MV7N2J/A☆A1602 Apple エアーポッズ ワイヤレス イヤホン,17500,17500,1,2019-10-10 07:47:09,2019-10-12 13:43:17,53.0,1,"ご覧頂き誠にありがとうございます♪♪落札しても安心のモバックスです♪♪※即送に努めます♪★落札者手数料、消費税8％は不要です♪お買い得♪★      **送料一律\700円★税込価格**（但し北海道は別途\500円・沖縄は別途\1000円。一部離島は別途\1000円の別途料金を頂きます）   ■【詳細】 ●メーカー・・・・Apple ●型番・・・・・・・AirPods 第2世代 with charging Cace  ( MV7N2J/A  )  ●状態・・・・・・・【新品未開封品】※購入後、未開封の商品です。  ●付属品・・・・・・・・新品標準セット揃っております♪  ●シリアル番号・・・GRMZC67GLX2Y    ※神経質な方は、入札をご遠慮下さい！！ノークレーム・ノーリターンでお願いします。※返品交換は受け付けませんのでご了承下さいませ♪★商品輸送時や倉庫保管時に外箱パッケージ等に若干のキズや凹みができてしまう場合がございますがご了承下さい。※商品によっては保管期間を含む場合がございますがご了承ください。※初期不良等の保証はメーカー対応となっております。【定休日】毎週火曜日※定休日の、発送・対応等出来ません。 月曜日13時の決済確定確認分までの対応となりますのでご了承下さい。 お客様には大変ご迷惑をお掛け致しますが、翌日水曜日より、順次対応させていただきます。 あらかじめご了承下さいませ。   ★★送料一律\700円です★★（但し北海道は別途\500円、沖縄は別途\1000円、一部離島は別途\1000円の別途料金を頂きます）※配送業者の関しましては基本は佐川急便出の発送になりますが、配送状況によりゆうパック等にこちらで変更させていただく場合がございますので予めご了承下さい。 ※代引きは、別途手数料が必要になります。（60サイズ以上は対応不可です）▼料金別代引き手数料一覧 （落札価格＋送料の合計金額により異なります。）[ 1万円以下 ]  324円[ 3万円以下 ]  432円[10万円以下]  648円[30万円以下] 1,080円ご了承の程よろしくお願い致します。（悪い評価が目立つ方、評価が15未満の方の代引きは、お断りさせて 頂きますので、予めご了承下さい。）    ※注意事項※ （ご確認の上、入札にご参加下さい。） (商品発送までスムーズにする為、ご協力お願い致します。) ※ヤフー取引ナビ以外からの、不審なメール等にはご注意下さい。落札後、何か不審な点（電話又はメール）がありましたら、当店に直接お電話又はヤフー取引ナビよりご連絡下さい。 ◆お約束として、落札後24時間以内にご連絡、振込案内のメールから３日以内にご入金（土日祝は除く）をお願い致します。１５時までに入金確認した場合、即日発送致します。１５時以降の確認も出来る限り、即日発送を心掛けております。佐川急便での発送となります。  ◆落札後キャンセル・連絡無し等トラブルが多い為、新規ＩＤ・悪い評価が目立つ方の入札は、取り消しさせて頂く場合がございますので予めご了承下さい。前記に該当する方や評価１０未満の方が落札された場合、落札から１２時間以内に商品発送先の、郵便番号・ご住所・お名前・電話番号・お振込み方法＆予定日を、（ヤフオク）取引ナビよりお送り下さい。時間内にご連絡頂けない時は、キャンセルとみなし落札削除させていただきます。その際、自動的に悪い評価がつきますのでご注意下さい。 評価が著しく悪い方の入札は、ご遠慮願います。 ◆ 全てのキャリアの端末について、初期化の際に購入時のプリインストールのデータ（アプリやデコメールなど）が、削除される端末がありますのでご了承下さ い。お手数ですが必要な方は、各キャリアや端末メーカーのホームページからダウンロードして下さい。一部出来ない端末もあります。 ◆オークションという性質上、原則ノークレーム・ノーリターンでお願い致します。細かな傷やほこり等に神経質な方、注意事項など気になる方は入札をお控え下さい。 ★～Yahooかんたん決済をご利用になられる方へ～★携帯電話などの決済処理された代金は、落札者が受け取り完了手続きをするまで一定期間、Yahoo側が預かる形となっております。つきましては商品の到着・ご確認後、速やかに受け取り完了手続きをお取りになって頂きます様、ご協力宜しくお願い致します。 ～～～～～～～～～～～～～～～～～～～～～～～～～～～～～～～～＊商品販売価格：落札価格＋送料、＊代金支払時期：落札後３日以内（土日祝は除く）、＊代金支払方法：かんたん決済、代引き＊商品引渡時期：入金確認後２日以内発送、＊引取特約事項：店頭販売は当店保証規定に従い対応、携帯端末リサイクルショップ、≪モバックス（mobax）≫梅田ヨドバシ前店大阪市北区芝田2丁目2番13号日生ビル東館2階 207A号室TＥＬ＆ＦＡＸ：06－6136－6127 (他の機種なども色々入荷・激安販売中！)※携帯電話以外にも、ノートパソコン・ゲーム機・デジカメ・iPod等の小型電化製品も買取販売してます。 郵送も大歓迎ですので、宜しくお願い致します。(故障・水没・盗難品などを除く）古物商許可証：大阪府公安委員会、第６２１１５０１４３３５３号～～～～～～～～～～～～～～～～～～～～～～～～～～～～～～～～お支払い金額★落札価格＋送料一律\700円（但し北海道は別途\500円、沖縄は別途\1000円、一部離島は別途\1000円別途料金を頂きます）※代引き手数料は正規代引手数料になります。（落札金額により変動がありますので、代引きの場合は落札後に計算してお知らせいたします♪）お支払い方法◆Yahooかんたん決済     ◆代引きお取引方法オークション終了↓落札者：発送先、お支払い方法の連絡・代金お支払い及び支払い完了連絡↓落札者：受取完了連絡",1519,5,6
4,1,"新品 保証スタート Apple AirPods with Charging Case 第2世代 MV7N2J/A 送料無料 在庫処分 1,000円～",910,15500,0,2019-10-07 08:53:47,2019-10-12 13:35:31,124.0,20,"新品 保証スタート Apple AirPods with Charging Case 第2世代 MV7N2J/A 送料無料 在庫処分 1,000円～            当店のオークションへご入札頂く前に、以下の内容をよくお読み頂き、ご確認下さい。    商品紹介       項　目 説　明     メーカー Apple   仕　様 仕様は参考サイトをご覧下さい。参考サイト   商品について  商品は新品、未開封品です。 本体は新品、パッケージシュリンク未開封です。 保証がすでに始まっており、有効期限 (推定)：2020年7月8日までのメーカー保証となります。在庫処分の為1,000円からのスタートとなります。 ＊オークション終了間際には質問に答えられない場合がございますのでご注意ください。                       ＊希望落札価格を設定してない商品においては、即決はできませんのでご了承下さい。         お支払い方法に関して  「Yahoo!かんたん決済」「銀行振込」",22632,62,0
5,1,【未開封】新品未開封 アップル Apple AirPods with charging case 第2世代 Air Pods2 MV7N2J/A iPhone ,100,17500,0,2019-10-10 06:19:58,2019-10-12 13:19:58,55.0,18,【未開封】 未使用 Air Pods2 新品 MV7N2J/A 送料無料ノークレーム、ノーリターン、ノーキャンセルでお願い致します。お支払い方法はYahoo!かんたん決済か口座振込です。落札後24時間以内にご連絡をお願い致します。ない場合は落札者都合でキャンセルさせていただきます。よろしくお願いします。,468,3,3
6,0,【新品未開封】 送料無料Apple 純正 AirPods エアーポッズ with Charging Case 第2世代 2019年 MV7N2J/A アップル ワイヤレスイヤホン,17800,17800,1,2019-10-08 14:11:41,2019-10-12 13:14:10,95.0,1,Apple AirPods with Charging Case 2019年モデル MV7N2J/A製品紹介（Apple HPより）https://www.apple.com/jp/airpods/新品未開封9個在庫ございまして、同梱できます。複数落札結構です。よろしくお願いいたします。,1321,51,0
7,1,【新品未開封】Apple AirPods with Charging Case（第2世代）(MV7N2J/A)【送料無料】,18000,18500,1,2019-10-09 17:04:12,2019-10-12 13:04:11,67.0,1,新品未開封のApple AirPods with Charging Case（第2世代）(MV7N2J/A)です。製品の仕様については以下をご確認くださいhttps://www.apple.com/jp/airpods/・新規(5以下)や評価の悪い方(95%未満)は入札を取り消す場合があります。・落札から24時間以内にかんたん決済の手続きが確認できない場合には、落札者都合で落札者を削除させていただきます。,165,0,0
8,0,新品 目玉 ケ-ス AirPods Z-1K 軽量小型 AirPods第1世代と第2世代に対応 Apple AirPods,1,101,1,2019-10-11 12:49:57,2019-10-12 12:49:57,24.0,1,▼商品詳細▼AirPods ケ-ス Apple AirPods 第1/2世代に適用【前のLEDライトが見える】シリコン素材 ソフト エア-ポッズ用ケ-ス カラビナ付き 紛失防止 滑り止め 全面保護カバ- 脱着簡単 着装ままワイヤレス充電可能 耐衝撃 防塵 軽量小型 AirPods第1世代と第2世代に対応              BUYUNEED                             BUYUNEED               ●お支払い代金【落札代金】＋【送料】＝【お支払い代金】 送料は全国一律　1280円となります。●お支払い方法 Yahoo！かんたん決済●発送方法ヤマト運輸、ゆうバック、佐川急便等。 ※局留め、その他の商品との同梱や領収証の添付はお受けできませんこと予めご了承下さい。,79,0,0
9,0,新品　未使用　エアポッズ　第2世代　2019年8月1日購入 新型 Bluetooth MV7N2J/A　AirPods with Charging Case　未開封品,17000,17000,0,2019-10-06 01:45:54,2019-10-12 12:45:09,154.0,1,新品未開封品8月1日にヤマダ電機にて購入レシートはお付けします。MV7N2J/A AirPods with Charging Case,290,3,4
10,1,送料無料/おまけあり/A1938/第2世代/第二世代/2019/新型/新品未使用/充電ケースのみ/Apple AirPods/エアーポッド/エアーポッズ/アップル/O,7900,7900,1,2019-10-11 09:46:29,2019-10-12 04:00:34,18.0,1,送料無料■充電ケースのみ■第2世代(第二世代)■モデル番号：A1938（Wireless Charging Case）■新型のワイヤレス充電タイプ(2019年版)■新品・未使用■Apple正規品■おまけとして、写真にうつっている「イヤピース（両耳）」（新品）をお付けします。,663,37,0
11,1,送料無料/おまけあり/第2世代/第二世代/2019/新型/新品未使用/正規品/右耳のみ/右のみ/右側のみ/Apple AirPods/エアーポッズ/アップル/ミ,6700,6700,1,2019-10-11 09:32:02,2019-10-12 03:46:53,18.0,1,送料無料■右耳のみ■第2世代、新型のAirPods（2019年版）■新品未使用■Apple正規品 ■おまけとして、写真にうつっているイヤピース（両耳）をお付けします。,663,37,0
12,0,airpods 第2世代 充電ケース 新品 未使用品,6999,6999,1,2019-10-11 01:50:39,2019-10-12 01:31:54,23.0,1,airpods 第2世代 充電ケース 新品 未使用品airpods 第2世代(MV7N2J/A)の充電ケースです！付属品無しでほケース本体のみのお渡しとなります。新品未使用品！プチプチにしっかりと包んで安全な形でお送り致します^^,66,0,0
13,0,【未使用】Apple AirPods エアポッズ Bluetooth ワイヤレスイヤホン with Charging Case 第2世代 MV7N2J/A ※サポートなし 10494684,12500,14500,0,2019-10-06 05:50:31,2019-10-11 13:50:07,127.0,5,■商品詳細  商品   【未使用】Apple AirPods エアポッズ Bluetooth ワイヤレスイヤホン with Charging Case 第2世代 MV7N2J/A ※サポートなし 10494684    メーカー保証   アップルサポート(推定)：なし    内容物・付属品   完品,40540,190,3
14,0,Apple Airpods Wireless Ckarging Case 第2世代 MRXJ2J/A アップル アイポッド ワイヤレス◎新品 mb☆☆☆,15000,18000,0,2019-10-04 08:00:39,2019-10-11 13:10:39,173.0,7,商品詳細 ◆サイズ ・AirPods（左右各）：16.5 × 18.0 × 40.5 mm ・Wireless Charging Case： 44.3 × 21.3 × 53.5 mm ◆未開封の未使用ですが専門店の新品同様を求める神経質な方はご遠慮願います。◆画像をよくご覧になり、きちんと取引詳細を確認後、ご自身の判断で責任を持ってのご入札をお願い致します。◆ノークレームノーリターンのオークションでの取引を理解されている方のみのご入札をお願いします。◆当方の出品内容をきちんと最初から最後まで読んで頂き、ご了承頂ける場合のみ入札をお願いします。入札前に不満や不安がある方は絶対に入札しないでください。落札後に記載事項をご覧いただいてなかったり、攻撃的だとこちらが感じた場合は、トラブル防止の為、やむを得ず落札者様都合でキャンセルさせて頂くこともございます。それについて当方からは評価致しませんがヤフーから自動的に「非常に悪い」と付きます。報復評価もご遠慮ください。◆専門店にて定価販売の新品商品ではありません。同様の品質並びにサービスをお求めの方は入札ご遠慮下さい。◆専門店ではございませんので見落としや説明不足、間違い等あるかもしれません。また、それについての保障や返品対応もできません。オークションでの取引を理解している方のみ入札下さい。◆わからない点や不明な点は必ず入札前にご質問下さい。思い込みでの入札は絶対にしないで下さい。 ◆落札後の連絡は２４時間以内、決済は48時間以内でお願いします。その期日を過ぎた場合は予告なく「落札者都合」にて削除し、次点落札の方へお譲り致します。    発送詳細  ■佐川急便 (追跡可・保証あり・宅配業者指定不可) 関西・中国・中部・北陸 ￥600 関東・信越・四国・九州 ￥700 東北 ￥1000 北海道 ￥1500 沖縄及び一部離島 別途見積☆沖縄への配送は船便となる場合があります。その場合、到着まで日数がかかりますのでご了承下さい。 ☆プチプチを巻いたり、再利用のダンボールを使用しての簡易的な梱包での発送になります。☆送料を安くする為、できるだけコンパクトに畳んで発送致します。☆箱等(ギフト等は対応できません)に入れての発送をご希望の場合は別途料金頂きます。    支払詳細 ■yahooかんたん決済     注意事項   *PCにより色の見え方が違う場合もございますので、ご了承下さい。*主に代理出品です。*撮影に使用しているアクセサリー等は含まれておりません。*個人保管品です。商品に完璧を求められる方、神経質な方、短気な方、クレーマー体質の方は入札ご遠慮願います。トラブル回避の為、やむを得ず入札を取り消しとさせて頂く場合もございます。*配送業者、発送方法のご希望には添えません。取引内容をしっかりと読んで頂き、了承頂ける方のみ入札下さい。*領収書の発行をご希望の場合は発行に伴う手数料を頂きます。*引き取り可能商品の引き取りは1週間以内でお願いします。それ以降になる場合は保管料1日500円を頂きます。*落札後、４８時間以内にご連絡いただけない場合は、落札者都合によるキャンセルとして落札を取り消させていただく場合がございます。ご了承ください。*評価は落札者さまより頂いた場合のみ、こちらからの評価を致しますが、1ヶ月のうちに数回まとめて評価をしているので、すぐにできない場合もございます。ご了承下さい。*終了時直前に『入札の取り消しをお願いします』と連絡を頂いても即対応ができません。そのまま落札となった場合は「落札者都合」にて取り消し致します。当方からは評価致しませんが、ヤフーより自動的に「非常に悪い」と評価が付きますのでよく考えてからの入札をお願いします。*同梱希望などは事前に質問等頂きます様宜しくお願い致します。*落札後に送料の値下げ等強要される場合は「落札者都合」での取り消しと致します。*当方で確認できる範囲で検品して出品しておりますが、専門店ではないので記載漏れや間違いがあるかもしれません。高額落札となった場合も専門店のような返品、交換等はお受けできません。そのようなサービスをお求めの方は実店舗にて正規価格でのご購入をおすすめ致します。      Template by 無料★オークションテンプレート作成 ドリーム♪Image (C)もずねこさん  ★ 他にもいろいろ出品しています。ぜひご覧ください。 ★,3137,13,4
15,0,新品未使用、未開封！☆ Apple AirPods with Charging Case MV7N2J/A 第２世代 ワイヤレスイヤホン　アップル,15000,17000,0,2019-10-06 04:09:50,2019-10-11 13:09:50,129.0,5,Apple AirPods with Charging Case MV7N2J/A 第２世代 ワイヤレスイヤホンの新品、未使用、未開封品になります。◆本年9月に大手量販店で購入しましたが、使用予定が無いので出品します◆外装フィルも購入時のままの未開封品です◆製品詳細はメーカーホームページでご確認ください◆新品につきノークレーム、ノーリターンでご了解頂ける方のみご入札をお願いします,276,0,3
16,0,Apple純正 AirPods 第2世代 イヤホン MV7N2J/A 充電ケース＋lighteningケーブルのみ イヤホン無し 新品未使用品,7300,7300,1,2019-10-10 08:04:20,2019-10-11 03:39:29,19.0,1,Apple純正 AirPods 第2世代 イヤホン MV7N2J/A 充電ケース＋lighteningケーブルのみ イヤホン無し 新品未使用品セット内容純正充電ケース純正lighteningケーブル箱クイックスタートガイド※充電ケースとlighteningケーブルのみになります。ワイヤレス充電には対応していません。イヤホンはありません。ご注意下さい。配送は以下にて行います。レターパックプラス 全国一律送料520円（追跡番号有り 保証無し）お支払いはヤフオク簡単決済のみになります。,2744,10,0
17,1,Apple AirPods2 MV7N2J/A エアーポッズ 第2世代 ワイヤレスイヤホン 新品未開封　①,18000,18000,1,2019-10-10 13:57:59,2019-10-11 01:12:23,11.0,1,□商品詳細        Apple airpods 新品未開封です 型番:MV7N2J/A（第2世代）  2019年9月購入、Appleの正規補償が1年つきます  入金確認後、極力当日、遅くとも1～2日以内には発送します   こちらの商品はワイヤレス充電には非対応です         □支払詳細        かんたん決済にてお願いいたします         □発送詳細        入金確認後3日以内に追跡番号・保証付きの方法で発送します。         □注意事項        落札後音沙汰のない方が多くトラブルが発生しています 24時間以内の入金をお願いします やむをえない事情がある場合は入札前に質問をください,625,13,0
18,1,Apple 純正 AirPods　第2世代　新品　MV7N2J/A 充電ケース＋Lightningケーブルのみ イヤホン無し,6500,6500,1,2019-10-08 12:50:46,2019-10-10 23:44:51,58.0,1,Apple AirPods with Charging Case MV7N2J/A 第２世代 ワイヤレスイヤホン☆写真1枚目の充電ケース Lightningケーブルのみです。☆イヤホンは無し。ご注意下さい。新品未使用です。 商品詳細はアップル公式ページを参照ください。送料は定形外郵便を予定しています。,232,0,0
19,1,★☆【未開封新品】送料無料 新品 Apple第2世代　AirPods（エアポッド） with Wireless Charging Case　MRXJ2J/A　ワイヤレスイヤホン☆★,21000,21000,1,2019-10-09 11:02:59,2019-10-10 16:46:50,29.0,1,★☆【未開封新品】送料無料 新品  Apple アップル　第2世代　AirPods（エアポッド） with Wireless Charging Case　MRXJ2J/A　ワイヤレスイヤホン☆★★商品説明★商品の特徴送料無料 新品  Apple アップル　第2世代　AirPods（エアポッド） with Wireless Charging Case　MRXJ2J/A　ワイヤレスイヤホン★注意事項★◎ノークレーム＆ノーリターンで、御願い致します◎新品未開封品ですが、神経質なかたは入札をご遠慮ください。。★発送詳細★送料は無料です発送方法の選択はできません。※オークション終了後、24時間以内に連絡がない場合は落札者の都合により削除しますのでご注意願います。ま★支払方法★■Yahoo!かんたん決済 こちらの商品案内は 「■@即売くん4.88■」 で作成されました。この他にも出品しておりますので宜しければご覧ください。,723,8,0
