,is_free_shipping,product_name,start_price,end_price,is_prompt,start_time,end_time,timedelta,bidders,setsumei,good,bad,capture_count
20,0,新品 未開封 Apple AirPods with Charging Case 第2世代 MV7N2J/A ワイヤレスイヤホン,16500,16500,0,2019-10-10 02:25:04,2019-10-10 15:18:35,12.0,1,ご覧いただきありがとうございますApple AirPods with Charging Case MV7N2J/A 第2世代 ワイヤレスイヤホン新品 未使用 未開封品速やかな発送を心掛けています,2387,4,0
21,0,Apple純正 AirPods 第2世代 右 イヤホン MV7N2J/A 右耳のみ 新品未使用品,7100,7100,1,2019-10-09 12:17:01,2019-10-10 14:26:23,26.0,1,Apple純正 AirPods 第2世代 右 イヤホン MV7N2J/A 右耳のみ 新品未使用品Apple純正 AirPods 第2世代 右 イヤホン MV7N2J/A 右耳のみ 新品未使用品になります。※右耳のみになります。ご注意下さい。配送は以下にて行います。定形外 全国一律送料120円（追跡番号無し 保証無し）スマートレター 全国一律送料 180円 （追跡番号無し 保証無し）レターパックライト 全国一律送料 370円（追跡番号有り 保証無し）レターパックプラス 全国一律送料520円（追跡番号有り 保証無し）お支払いはヤフオク簡単決済のみになります。,2744,10,0
22,0,【新品未使用】AirPods (第2世代) with Charging Case 2019年 MV7N2J/A ②,15000,16500,0,2019-10-07 04:41:27,2019-10-10 13:40:46,80.0,4,AirPods with Charging Caseの第2世代です。新品・未使用・未開封品です。ノークレーム・ノーリターンでお願いします。それではよろしくお願いします。,294,0,2
23,0,【新品未使用】AirPods (第2世代) with Charging Case 2019年 MV7N2J/A ①,15000,16500,0,2019-10-07 04:40:40,2019-10-10 13:36:13,80.0,4,AirPods with Charging Caseの第2世代です。新品・未使用・未開封品です。ノークレーム・ノーリターンでお願いします。それではよろしくお願いします。,294,0,2
24,1,"新品 保証スタート Apple AirPods with Charging Case 第2世代 MV7N2J/A 送料無料 在庫処分 1,000円～",910,15599,0,2019-10-07 08:53:47,2019-10-10 13:31:01,76.0,33,"新品 保証スタート Apple AirPods with Charging Case 第2世代 MV7N2J/A 送料無料 在庫処分 1,000円～            当店のオークションへご入札頂く前に、以下の内容をよくお読み頂き、ご確認下さい。    商品紹介       項　目 説　明     メーカー Apple   仕　様 仕様は参考サイトをご覧下さい。参考サイト   商品について  商品は新品、未開封品です。 本体は新品、パッケージシュリンク未開封です。 保証がすでに始まっており、有効期限 (推定)：2020年6月22日までのメーカー保証となります。在庫処分の為1,000円からのスタートとなります。 ＊オークション終了間際には質問に答えられない場合がございますのでご注意ください。                       ＊希望落札価格を設定してない商品においては、即決はできませんのでご了承下さい。         お支払い方法に関して  「Yahoo!かんたん決済」「銀行振込」",22632,62,0
25,1,送料無料 新品未開封 Apple AirPods with Wireless Charging Case 第2世代 MRXJ2J/A ワイヤレス充電器,19900,19900,1,2019-10-09 13:37:47,2019-10-10 13:29:52,23.0,1,シュリンク包装された新品未開封品です・注意事項スムーズなお取引を行う為、落札後24時間以内にご入金お手続きをお願い致します。ご入金が確認できない場合は落札者様都合でのオークション削除となります。落札後のキャンセル及び返品はお受け出来ません。新品の物で初期不良等ございましたらメーカーへお問い合わせ下さい。気になる点や要望等がありましたら落札前にご質問ください。落札後に要望等ありましても対応出来ない場合がございます。,1168,16,4
26,0,Apple純正 AirPods 第2世代 イヤホン MV7N2J/A 充電ケースのみ 新品未使用品,7000,7000,1,2019-10-09 13:26:53,2019-10-10 13:22:22,23.0,1,Apple純正 AirPods 第2世代 イヤホン MV7N2J/A 充電ケースのみ 新品未使用品Apple純正 AirPods 第2世代 イヤホン MV7N2J/A 充電ケースのみ 新品未使用品になります。※充電ケースのみになります。イヤホンはありません。ご注意下さい。配送は以下にて行います。レターパックライト 全国一律送料 370円（追跡番号有り 保証無し）レターパックプラス 全国一律送料520円（追跡番号有り 保証無し）お支払いはヤフオク簡単決済のみになります。,2744,10,0
27,1,[新品未使用品]AirPods (エアーポッズ/第2世代) with Charging Case 2019年 新型 Bluetooth MV7N2J/A 【純正】 ,1,19500,1,2019-10-09 14:00:17,2019-10-10 12:40:14,22.0,17,[新品未使用品]AirPods (エアーポッズ/第2世代) with Charging Case 2019年 新型 ブルートゥースイヤホン フルワイヤレス インナーイヤー型 MV7N2J/A 【純正】 [ワイヤレス(左右分離) /Bluetooth]商品説明の通りです。ご理解ある方よろしくお願い申し上げます。* ～商品説明～ * さらに魔法に近づきました。新しいAirPodsはワイヤレスヘッドフォンの体験を一新します。ケースから取り出すだけで、あなたのiPhone、Apple Watch、iPad、Macと一緒に使えます。ワンタップのシンプルな設定で、AirPodsは魔法のように機能します。自動的にオンになり、いつでも接続された状態になります。耳に装着されたことを感知するので、耳から外すと一時停止します。AirPodsは両耳でも片耳だけでも使えます。音量を調節したり、曲を変えたり、電話をかけたり、道順を調べたい時は「Hey Siri」と声をかけて頼むだけ。ダブルタップして、音楽のトラックやPodcastの番組を再生したりスキップすることもできます。AirPodsは1回の充電で5時間の再生1と3時間の通話ができます2。しかも24時間以上聴き続けられるように複数回充電できる充電ケースもついているので、AirPodsはあなたの毎日にしっかりついていきます3。急いでいる時は、ケースで15分充電するだけで、3時間の再生4または2時間の通話ができるようになります5。まったく新しいApple H1ヘッドフォンチップで駆動するAirPodsは、光学センサーとモーション加速度センサーによって、あなたの耳に装着されたことを感知します。両耳で聴く時も、片耳だけの場合も、H1チップはイヤフォンへのオーディオの送信とマイクロフォンの接続を自動で行います。通話中やSiriに話しかけている時には、音声を検知するもう一つの加速度センサーがビームフォーミングマイクロフォンと連係しながら、周囲のノイズを取り除いてあなたの声に狙いを定めます。★゜'・:*:・'゜☆。.:*:・'*:・'゜☆。.:*:・'゜★゜'・:*:・'゜☆。.:*:・'゜★゜'・:*:・'゜☆。.:*:・'゜★゜'・:*:・'゜☆。.:*:・'゜★★新品・未使用 ☆頂き物、かつ個人所有につき、神経質な方のご入札はご遠慮ください。★落札後の返品、キャンセルはご遠慮ください。★落札後、落札者様の都合で以前にキャンセルされた方は自動的にキャンセルさせて頂きますのでご理解ご了承願います。送料込み★ノークレーム、ノーリターンご理解ご了承頂ける方宜しくお願い致します。★悪い評価５以上の方は削除させて頂きますのでご了承願います。★゜'・:*:・'゜☆。.:*:・'*:・'゜☆。.:*:・'゜★゜'・:*:・'゜☆。.:*:・'゜★゜'・:*:・'゜☆。.:*:・'゜★゜'・:*:・'゜☆。.:*:・'゜★,115,0,0
28,1,[新品未使用品]AirPods (エアーポッズ/第2世代) with Charging Case 2019年 新型 MV7N2J/A 【純正】 [ワイヤレス(左右分離) /Bluetooth],1,19000,1,2019-10-07 13:18:51,2019-10-10 12:18:51,71.0,53,[新品未使用品]AirPods (エアーポッズ/第2世代) with Charging Case 2019年 新型 ブルートゥースイヤホン フルワイヤレス インナーイヤー型 MV7N2J/A 【純正】 [ワイヤレス(左右分離) /Bluetooth]商品の説明の通りです。ご理解ある方よろしくお願い申し上げます。* ～商品説明～*さらに魔法に近づきました。新しいAirPodsはワイヤレスヘッドフォンの体験を一新します。ケースから取り出すだけで、あなたのiPhone、Apple Watch、iPad、Macと一緒に使えます。ワンタップのシンプルな設定で、AirPodsは魔法のように機能します。自動的にオンになり、いつでも接続された状態になります。耳に装着されたことを感知するので、耳から外すと一時停止します。AirPodsは両耳でも片耳だけでも使えます。音量を調節したり、曲を変えたり、電話をかけたり、道順を調べたい時は「Hey Siri」と声をかけて頼むだけ。ダブルタップして、音楽のトラックやPodcastの番組を再生したりスキップすることもできます。AirPodsは1回の充電で5時間の再生1と3時間の通話ができます2。しかも24時間以上聴き続けられるように複数回充電できる充電ケースもついているので、AirPodsはあなたの毎日にしっかりついていきます3。急いでいる時は、ケースで15分充電するだけで、3時間の再生4または2時間の通話ができるようになります5。まったく新しいApple H1ヘッドフォンチップで駆動するAirPodsは、光学センサーとモーション加速度センサーによって、あなたの耳に装着されたことを感知します。両耳で聴く時も、片耳だけの場合も、H1チップはイヤフォンへのオーディオの送信とマイクロフォンの接続を自動で行います。通話中やSiriに話しかけている時には、音声を検知するもう一つの加速度センサーがビームフォーミングマイクロフォンと連係しながら、周囲のノイズを取り除いてあなたの声に狙いを定めます。★゜'・:*:・'゜☆。.:*:・'*:・'゜☆。.:*:・'゜★゜'・:*:・'゜☆。.:*:・'゜★゜'・:*:・'゜☆。.:*:・'゜★゜'・:*:・'゜☆。.:*:・'゜★★新品・未使用☆頂き物、かつ個人所有につき、神経質な方のご入札はご遠慮ください。★落札後の返品、キャンセルはご遠慮ください。★落札後、落札者様の都合で以前にキャンセルされた方は自動的にキャンセルさせて頂きますのでご理解ご了承願います。送料込み★ノークレーム、ノーリターンご理解ご了承頂ける方宜しくお願い致します。★悪い評価５以上の方は削除させて頂きますのでご了承願います。★゜'・:*:・'゜☆。.:*:・'*:・'゜☆。.:*:・'゜★゜'・:*:・'゜☆。.:*:・'゜★゜'・:*:・'゜☆。.:*:・'゜★゜'・:*:・'゜☆。.:*:・'゜★,115,0,0
29,1,[新品未使用品]AirPods with Wireless Charging Case (エアーポッズ/第2世代) 2019年 新型 ブルートゥースイ フルワイヤレス ワイヤレス,1,22000,1,2019-10-07 13:18:30,2019-10-10 12:18:30,71.0,46,[新品未使用品]AirPods with Wireless Charging Case (エアーポッズ/第2世代) 2019年 新型 ブルートゥースイヤホン フルワイヤレス インナーイヤー型 【純正】 [ワイヤレス(左右分離) /Bluetooth]商品の説明の通りです。ご理解ある方よろしくお願い致します。* ～商品説明～*Wireless Charging Caseが付属した新しいAirPodsは、インテリジェントな設計、画期的なテクノロジー、透き通るほどクリアなサウンドを持っています。新しいApple H1ヘッドフォンチップで動くので、手を使わずに声だけでSiriを起動できるようになりました。これからは1回の充電で最大3時間の通話ができます。自動でオンになり、自動で接続すべてのApple製デバイスで簡単に設定「Hey Siri」と声をかけるだけで瞬時にSiriへアクセスダブルタップで再生またはスキップ新しいApple H1ヘッドフォンチップで、デバイスとのワイヤレス接続がさらに速くケースですばやく充電Qi対応充電マットを使ったワイヤレス充電と、Lightningコネクタを使った充電に対応豊かで質の高いオーディオと音声デバイス間の切り替えはシームレス★゜'・:*:・'゜☆。.:*:・'*:・'゜☆。.:*:・'゜★゜'・:*:・'゜☆。.:*:・'゜★゜'・:*:・'゜☆。.:*:・'゜★゜'・:*:・'゜☆。.:*:・'゜★★新品・未使用☆頂き物、かつ個人所有につき、神経質な方のご入札はご遠慮ください。★落札後の返品、キャンセルはご遠慮ください。★落札後、落札者様の都合で以前にキャンセルされた方は自動的にキャンセルさせて頂きますのでご理解ご了承願います。送料込み★ノークレーム、ノーリターンご理解ご了承頂ける方宜しくお願い致します。★悪い評価５以上の方は削除させて頂きますのでご了承願います。★゜'・:*:・'゜☆。.:*:・'*:・'゜☆。.:*:・'゜★゜'・:*:・'゜☆。.:*:・'゜★゜'・:*:・'゜☆。.:*:・'゜★゜'・:*:・'゜☆。.:*:・'゜★,115,0,0
30,1,[新品未使用品]AirPods (エアーポッズ/第2世代) with Charging Case 2019年 新型 MV7N2J/A 【純正】 Bluetooth,1,19000,1,2019-10-07 13:17:42,2019-10-10 12:17:42,71.0,23,[新品未使用品]AirPods (エアーポッズ/第2世代) with Charging Case 2019年 新型 ブルートゥースイヤホン フルワイヤレス インナーイヤー型 MV7N2J/A 【純正】 [ワイヤレス(左右分離) /Bluetooth]商品の説明の通りになります。ご理解ある方よろしくお願い申し上げます。* ～商品説明～ * さらに魔法に近づきました。新しいAirPodsはワイヤレスヘッドフォンの体験を一新します。ケースから取り出すだけで、あなたのiPhone、Apple Watch、iPad、Macと一緒に使えます。ワンタップのシンプルな設定で、AirPodsは魔法のように機能します。自動的にオンになり、いつでも接続された状態になります。耳に装着されたことを感知するので、耳から外すと一時停止します。AirPodsは両耳でも片耳だけでも使えます。音量を調節したり、曲を変えたり、電話をかけたり、道順を調べたい時は「Hey Siri」と声をかけて頼むだけ。ダブルタップして、音楽のトラックやPodcastの番組を再生したりスキップすることもできます。AirPodsは1回の充電で5時間の再生1と3時間の通話ができます2。しかも24時間以上聴き続けられるように複数回充電できる充電ケースもついているので、AirPodsはあなたの毎日にしっかりついていきます3。急いでいる時は、ケースで15分充電するだけで、3時間の再生4または2時間の通話ができるようになります5。まったく新しいApple H1ヘッドフォンチップで駆動するAirPodsは、光学センサーとモーション加速度センサーによって、あなたの耳に装着されたことを感知します。両耳で聴く時も、片耳だけの場合も、H1チップはイヤフォンへのオーディオの送信とマイクロフォンの接続を自動で行います。通話中やSiriに話しかけている時には、音声を検知するもう一つの加速度センサーがビームフォーミングマイクロフォンと連係しながら、周囲のノイズを取り除いてあなたの声に狙いを定めます。★゜'・:*:・'゜☆。.:*:・'*:・'゜☆。.:*:・'゜★゜'・:*:・'゜☆。.:*:・'゜★゜'・:*:・'゜☆。.:*:・'゜★゜'・:*:・'゜☆。.:*:・'゜★★新品・未使用 ☆頂き物、かつ個人所有につき、神経質な方のご入札はご遠慮ください。★落札後の返品、キャンセルはご遠慮ください。★落札後、落札者様の都合で以前にキャンセルされた方は自動的にキャンセルさせて頂きますのでご理解ご了承願います。送料込み★ノークレーム、ノーリターンご理解ご了承頂ける方宜しくお願い致します。★悪い評価５以上の方は削除させて頂きますのでご了承願います。★゜'・:*:・'゜☆。.:*:・'*:・'゜☆。.:*:・'゜★゜'・:*:・'゜☆。.:*:・'゜★゜'・:*:・'゜☆。.:*:・'゜★゜'・:*:・'゜☆。.:*:・'゜★,275,1,0
31,1,送料無料/おまけあり/第2世代/第二世代/2019/新型/新品未使用/正規品/左耳のみ/左のみ/左側のみ/Apple AirPods/エアーポッズ/アップル/ケ,6700,6700,1,2019-10-10 09:42:56,2019-10-10 12:12:59,2.0,1,送料無料■左耳のみ■第2世代、新型のAirPods（2019年版）■新品未使用■Apple正規品 ■おまけとして、写真にうつっているイヤピース（両耳）をお付けします。,663,37,0
32,1,[新品未使用品]AirPods with Wireless Charging Case (エアーポッズ/第2世代) 2019年 新型 ブルートゥースイヤホン 【純正】Bluetooth,1,24000,1,2019-10-06 15:07:47,2019-10-10 12:07:47,93.0,42,[新品未使用品]AirPods with Wireless Charging Case (エアーポッズ/第2世代) 2019年 新型 ブルートゥースイヤホン フルワイヤレス インナーイヤー型  【純正】 [ワイヤレス(左右分離) /Bluetooth]商品の説明の通りです。ご理解ある方よろしくお願い申し上げます。* ～商品説明～ *Wireless Charging Caseが付属した新しいAirPodsは、インテリジェントな設計、画期的なテクノロジー、透き通るほどクリアなサウンドを持っています。新しいApple H1ヘッドフォンチップで動くので、手を使わずに声だけでSiriを起動できるようになりました。これからは1回の充電で最大3時間の通話ができます。* 自動でオンになり、自動で接続* すべてのApple製デバイスで簡単に設定* 「Hey Siri」と声をかけるだけで瞬時にSiriへアクセス* ダブルタップで再生またはスキップ* 新しいApple H1ヘッドフォンチップで、デバイスとのワイヤレス接続がさらに速く* ケースですばやく充電* Qi対応充電マットを使ったワイヤレス充電と、Lightningコネクタを使った充電に対応* 豊かで質の高いオーディオと音声* デバイス間の切り替えはシームレス★゜'・:*:・'゜☆。.:*:・'*:・'゜☆。.:*:・'゜★゜'・:*:・'゜☆。.:*:・'゜★゜'・:*:・'゜☆。.:*:・'゜★゜'・:*:・'゜☆。.:*:・'゜★★新品・未使用 ☆頂き物、かつ個人所有につき、神経質な方のご入札はご遠慮ください。★落札後の返品、キャンセルはご遠慮ください。★落札後、落札者様の都合で以前にキャンセルされた方は自動的にキャンセルさせて頂きますのでご理解ご了承願います。送料込み★ノークレーム、ノーリターンご理解ご了承頂ける方宜しくお願い致します。★悪い評価５以上の方は削除させて頂きますのでご了承願います。★゜'・:*:・'゜☆。.:*:・'*:・'゜☆。.:*:・'゜★゜'・:*:・'゜☆。.:*:・'゜★゜'・:*:・'゜☆。.:*:・'゜★゜'・:*:・'゜☆。.:*:・'゜★,275,1,0
33,1,[新品未使用品] AirPods with Wireless Charging Case (エアーポッズ/第2世代) 2019年 新型 【純正】Apple MMEF2J/A ワイヤレスイヤホン,21000,21000,1,2019-10-07 13:12:51,2019-10-10 06:44:19,65.0,1,エアーポッズ  2 AirPods 2 第2世代 新品 正規品 未開封です。MRXJ2J/Aワイヤレス可能2019年９月末に購入したものです。他のワイヤレスイヤフォンが見つかったので出品します。iPhoneで使用すると特に便利です。Apple(アップル)Apple AirPods with Wireless Charging Case (最新モデル)（2019年 10月  9日 21時 33分 追加）値下げ対応致します！,15,0,3
34,0,Apple純正 AirPods 第2世代 イヤホン MV7N2J/A 充電ケース＋lighteningケーブルのみ イヤホン無し 新品未使用品,7300,7300,1,2019-10-09 10:19:18,2019-10-10 05:50:39,19.0,1,Apple純正 AirPods 第2世代 イヤホン MV7N2J/A 充電ケース＋lighteningケーブルのみ イヤホン無し 新品未使用品セット内容純正充電ケース純正lighteningケーブル箱クイックスタートガイド※充電ケースとlighteningケーブルのみになります。ワイヤレス充電には対応していません。イヤホンはありません。ご注意下さい。配送は以下にて行います。レターパックプラス 全国一律送料520円（追跡番号有り 保証無し）お支払いはヤフオク簡単決済のみになります。,2744,10,0
35,1,Apple 純正 AirPods　第2世代　新品　MV7N2J/A 左耳,6900,6900,1,2019-10-08 12:48:47,2019-10-09 22:18:38,33.0,1,Apple AirPods with Charging Case  MV7N2J/A 第２世代 ワイヤレスイヤホン PSEマークあり  ☆写真1枚目のイヤホン左耳のみです。 ☆右耳、箱、充電ケース、ケーブルは無し。ご注意下さい。  新品未使用です。 国内ネットショップで購入した正規品です。商品詳細はアップル公式ページを参照ください。事前にコメントいただければ、ご希望に応じて保証付の発送方法にも変更可能です。 出品直後の値下げはいたしませんので、 ご了承ください。,232,0,2
36,0,送料120円　Apple 純正 AirPods　第2世代　新品　MV7N2J/A 左耳 ,6800,6800,1,2019-10-06 12:56:47,2019-10-09 18:17:48,77.0,1,Apple AirPods with Charging Case MV7N2J/A 第２世代 ワイヤレスイヤホンPSEマークあり☆写真1枚目のイヤホン左耳のみです。☆右耳、箱、充電ケース、ケーブルは無し。ご注意下さい。新品未使用です。 2019年9月、国内ネットショップで購入した正規品です。商品詳細はアップル公式ページを参照ください。事前にコメントいただければ、ご希望に応じて保証付の発送方法にも変更可能です。出品直後の値下げはいたしませんので、ご了承ください。,232,0,2
37,1,Apple AirPods2 MV7N2J/A エアーポッズ 第2世代 ワイヤレスイヤホン 新品未開封　①,18000,18000,1,2019-10-09 12:52:53,2019-10-09 16:38:48,3.0,1,□商品詳細        Apple airpods 新品未開封です 型番:MV7N2J/A（第2世代）  2019年9月購入、Appleの正規補償が1年つきます  入金確認後、極力当日、遅くとも1～2日以内には発送します   こちらの商品はワイヤレス充電には非対応です         □支払詳細        かんたん決済にてお願いいたします         □発送詳細        入金確認後3日以内に追跡番号・保証付きの方法で発送します。         □注意事項        落札後音沙汰のない方が多くトラブルが発生しています 24時間以内の入金をお願いします やむをえない事情がある場合は入札前に質問をください,625,13,0
